{
  "$schema": "./api-surface.schema.json",
  "description": "Public API closure manifest. Every symbol reachable through a published exports map subpath is classified. scripts/check-api-closure.mjs derives the inventory from the built .d.ts files and fails when it drifts from this file. Classifications are stable: reclassifying an export is a reviewable change, never a side effect.",
  "classes": {
    "authority-boundary": "Mints or verifies a CapabilityAuthority.",
    "capability-construction": "Produces a definition, contract or binding that could become an invocable capability.",
    "execution-boundary": "Can cause a capability handler to run.",
    "exposure-boundary": "Projects capabilities to an agent, provider or transport.",
    "introspection-only": "Read-only projection of already-authorized state. Cannot execute or expose.",
    "utility": "No capability semantics: ids, schemas, errors, policies, sinks, constants.",
    "type": "Type-only export. Cannot execute."
  },
  "requires": {
    "authority": "Rejects construction/use without a genuine CapabilityAuthority.",
    "verifies": "Is itself the verification step.",
    "mints": "Produces the authority from a verified manifest.",
    "proof": "Emits or forwards private compiler proof; the value is inert until an authority accepts it.",
    "registry": "Executes only through registry.invoke, which already required authority.",
    "compiler": "Build-time only. Produces the manifest; never executes a capability.",
    "inert": "Reachable but cannot reach execution: no published boundary accepts its output."
  },
  "modules": {
    "@agent-surface/cli": {
      "ChangeClassification": {
        "kind": "type",
        "class": "type"
      },
      "changeCounts": {
        "kind": "value",
        "class": "introspection-only"
      },
      "ChangeKind": {
        "kind": "type",
        "class": "type"
      },
      "ContractChange": {
        "kind": "type",
        "class": "type"
      },
      "ContractReport": {
        "kind": "type",
        "class": "type"
      },
      "DEFAULT_SNAPSHOT": {
        "kind": "value",
        "class": "utility"
      },
      "diffContracts": {
        "kind": "value",
        "class": "introspection-only"
      },
      "OutputFormat": {
        "kind": "type",
        "class": "type"
      },
      "readManifest": {
        "kind": "value",
        "class": "introspection-only"
      },
      "renderReport": {
        "kind": "value",
        "class": "introspection-only"
      },
      "writeManifest": {
        "kind": "value",
        "class": "introspection-only"
      }
    },
    "@agent-surface/compiler": {
      "AgentSurfaceCompilerOptions": {
        "kind": "type",
        "class": "type"
      },
      "COMPILER_VERSION": {
        "kind": "value",
        "class": "utility"
      },
      "CONTRACT_FILE": {
        "kind": "value",
        "class": "utility"
      },
      "CompileCapabilityContractOptions": {
        "kind": "type",
        "class": "type"
      },
      "ExternalContractAllowEntry": {
        "kind": "type",
        "class": "type"
      },
      "ExternalContractPolicy": {
        "kind": "type",
        "class": "type"
      },
      "VIRTUAL_CONTRACT_ID": {
        "kind": "value",
        "class": "utility"
      },
      "agentSurface": {
        "kind": "value",
        "class": "capability-construction",
        "requires": "compiler",
        "conformance": [
          "AS-COMPILER-001",
          "AS-CONTRACT-002"
        ]
      },
      "canonicalJson": {
        "kind": "value",
        "class": "introspection-only"
      },
      "canonicalManifestJson": {
        "kind": "value",
        "class": "introspection-only"
      },
      "compileCapabilityContract": {
        "kind": "value",
        "class": "capability-construction",
        "requires": "compiler",
        "conformance": [
          "AS-COMPILER-001"
        ]
      },
      "computeManifestHash": {
        "kind": "value",
        "class": "introspection-only"
      },
      "manifestPayload": {
        "kind": "value",
        "class": "introspection-only"
      },
      "sha256": {
        "kind": "value",
        "class": "utility"
      },
      "verifyManifest": {
        "kind": "value",
        "class": "introspection-only"
      }
    },
    "@agent-surface/core": {
      "AGENT_CAPABILITY_ERROR_CODES": {
        "kind": "value",
        "class": "utility"
      },
      "AgentActionContext": {
        "kind": "type",
        "class": "type"
      },
      "AgentActionContract": {
        "kind": "type",
        "class": "type"
      },
      "AgentActionDefinition": {
        "kind": "type",
        "class": "type"
      },
      "AgentActionDescriptor": {
        "kind": "type",
        "class": "type"
      },
      "AgentAuthorizationContext": {
        "kind": "type",
        "class": "type"
      },
      "AgentCapabilityDescriptorUnion": {
        "kind": "type",
        "class": "type"
      },
      "AgentCapabilityErrorCode": {
        "kind": "type",
        "class": "type"
      },
      "AgentCapabilityErrorPayload": {
        "kind": "type",
        "class": "type"
      },
      "AgentComponentContract": {
        "kind": "type",
        "class": "type"
      },
      "AgentComponentContractDefinition": {
        "kind": "type",
        "class": "type"
      },
      "AgentComponentDefinition": {
        "kind": "type",
        "class": "type"
      },
      "AgentComponentDescriptor": {
        "kind": "type",
        "class": "type"
      },
      "AgentComponentRuntimeBindings": {
        "kind": "type",
        "class": "type"
      },
      "AgentConcurrency": {
        "kind": "type",
        "class": "type"
      },
      "AgentConsumer": {
        "kind": "type",
        "class": "type"
      },
      "AgentEffect": {
        "kind": "type",
        "class": "type"
      },
      "AgentEnvironment": {
        "kind": "type",
        "class": "type"
      },
      "AgentErrorRetry": {
        "kind": "type",
        "class": "type"
      },
      "AgentExposureGateway": {
        "kind": "type",
        "class": "type"
      },
      "AgentInvocation": {
        "kind": "type",
        "class": "type"
      },
      "AgentInvocationPolicyContext": {
        "kind": "type",
        "class": "type"
      },
      "AgentInvocationResult": {
        "kind": "type",
        "class": "type"
      },
      "AgentObservationContract": {
        "kind": "type",
        "class": "type"
      },
      "AgentObservationDefinition": {
        "kind": "type",
        "class": "type"
      },
      "AgentObservationDescriptor": {
        "kind": "type",
        "class": "type"
      },
      "AgentPlane": {
        "kind": "type",
        "class": "type"
      },
      "AgentPolicy": {
        "kind": "type",
        "class": "type"
      },
      "AgentPolicyContext": {
        "kind": "type",
        "class": "type"
      },
      "AgentProcedureBinding": {
        "kind": "type",
        "class": "type"
      },
      "AgentProcedureBindingRuntimeConfig": {
        "kind": "type",
        "class": "type"
      },
      "AgentProcedureContract": {
        "kind": "type",
        "class": "type"
      },
      "AgentProcedureContractDefinition": {
        "kind": "type",
        "class": "type"
      },
      "AgentProcedureDescriptor": {
        "kind": "type",
        "class": "type"
      },
      "AgentProcedureEffect": {
        "kind": "type",
        "class": "type"
      },
      "AgentProcedureExecutor": {
        "kind": "type",
        "class": "type"
      },
      "AgentProcedureRefDescriptor": {
        "kind": "type",
        "class": "type"
      },
      "AgentReadContext": {
        "kind": "type",
        "class": "type"
      },
      "AgentRegistrationHandle": {
        "kind": "type",
        "class": "type"
      },
      "AgentRouteInfo": {
        "kind": "type",
        "class": "type"
      },
      "AgentSchema": {
        "kind": "type",
        "class": "type"
      },
      "AgentSchemaError": {
        "kind": "value",
        "class": "utility"
      },
      "AgentSchemaIssue": {
        "kind": "type",
        "class": "type"
      },
      "AgentSurfaceDefinitionError": {
        "kind": "value",
        "class": "utility"
      },
      "AgentSurfaceDefinitionErrorCode": {
        "kind": "type",
        "class": "type"
      },
      "AgentSurfaceError": {
        "kind": "value",
        "class": "utility"
      },
      "AgentSurfaceEvent": {
        "kind": "type",
        "class": "type"
      },
      "AgentSurfaceLimits": {
        "kind": "type",
        "class": "type"
      },
      "AgentSurfaceRegistry": {
        "kind": "type",
        "class": "type"
      },
      "AgentSurfaceSnapshot": {
        "kind": "type",
        "class": "type"
      },
      "AgentTool": {
        "kind": "type",
        "class": "type"
      },
      "AgentToolset": {
        "kind": "type",
        "class": "type"
      },
      "AgentToolsetOptions": {
        "kind": "type",
        "class": "type"
      },
      "AuditEvent": {
        "kind": "type",
        "class": "type"
      },
      "AuditSink": {
        "kind": "type",
        "class": "type"
      },
      "CAPABILITY_CONTRACT_FORMAT_VERSION": {
        "kind": "value",
        "class": "utility"
      },
      "CONFIRMATION_ESCALATION": {
        "kind": "value",
        "class": "utility"
      },
      "CapabilityAuthority": {
        "kind": "type",
        "class": "type"
      },
      "CapabilityContractEntry": {
        "kind": "type",
        "class": "type"
      },
      "CapabilityContractKind": {
        "kind": "type",
        "class": "type"
      },
      "CapabilityContractManifest": {
        "kind": "type",
        "class": "type"
      },
      "CapabilityPolicyAttachment": {
        "kind": "type",
        "class": "type"
      },